[
  {
    "key": "medieval",
    "name_ru": "Средневековье",
    "year_start": 500,
    "year_end": 1400,
    "summary_ru": "Эпоха ~500–1400. Григорианский хорал, одноголосие, литургическая музыка. К XII веку появляется многоголосие — школа Нотр-Дам, Перотин, Леонин. Светская традиция — трубадуры и труверы. Музыка существует ради текста, не ради себя.",
    "cover_composer_id": "perotin"
  },
  {
    "key": "renaissance",
    "name_ru": "Возрождение",
    "year_start": 1400,
    "year_end": 1600,
    "summary_ru": "Эпоха ~1400–1600. Расцвет полифонии: Палестрина, Жоскен Депре, Лассо. Появляется печать нот, музыка становится товаром. Главные жанры — месса, мотет, мадригал. Конец эпохи — рождение оперы во Флоренции.",
    "cover_composer_id": "palestrina"
  },
  {
    "key": "baroque",
    "name_ru": "Барокко",
    "year_start": 1600,
    "year_end": 1750,
    "summary_ru": "Эпоха ~1600–1750. Контрапункт, basso continuo, развитие сонаты, концерта и оперы. Бах, Гендель, Вивальди, Скарлатти. Музыка строится как архитектура — слой над слоем, по правилам. Преобладают клавесин и орган; современное фортепиано ещё не изобретено.",
    "cover_composer_id": "bach"
  },
  {
    "key": "classical",
    "name_ru": "Классицизм",
    "year_start": 1750,
    "year_end": 1820,
    "summary_ru": "Эпоха ~1750–1820. Симметрия, ясность, форма сонатного аллегро. Гайдн, Моцарт, ранний Бетховен. Появляется фортепиано как доминирующий клавишный инструмент. Музыка пишется не для церкви, а для аристократических салонов и публичных концертов.",
    "cover_composer_id": "mozart"
  },
  {
    "key": "romanticism",
    "name_ru": "Романтизм",
    "year_start": 1820,
    "year_end": 1890,
    "summary_ru": "Эпоха ~1820–1890. Эмоция важнее формы, программная музыка, виртуозность как самоцель. Шопен, Шуман, Лист, Мендельсон, ранний Брамс. Композитор — фигура героическая, выражающая внутренний мир. Расширение оркестра, рождение фортепианной миниатюры.",
    "cover_composer_id": "chopin"
  },
  {
    "key": "late-romanticism",
    "name_ru": "Поздний романтизм",
    "year_start": 1870,
    "year_end": 1910,
    "summary_ru": "Эпоха ~1870–1910. Огромный оркестр, длинные симфонии, гармония на грани атональности. Малер, Брукнер, Рихард Штраус, поздний Брамс, Чайковский. Симфония становится мировоззренческим высказыванием на 60–90 минут. Конец эпохи — слом тональной системы у Шёнберга.",
    "cover_composer_id": "mahler"
  },
  {
    "key": "early-modern",
    "name_ru": "Ранний модерн",
    "year_start": 1890,
    "year_end": 1930,
    "summary_ru": "Эпоха ~1890–1930. Импрессионизм Дебюсси и Равеля, ритмическая революция Стравинского, неоклассицизм, ранний Барток и Прокофьев. Тональность расшатывается, но не отменяется. Параллельно — додекафония Шёнберга и нововенской школы.",
    "cover_composer_id": "debussy"
  },
  {
    "key": "modern",
    "name_ru": "Модернизм",
    "year_start": 1925,
    "year_end": 1975,
    "summary_ru": "Эпоха ~1925–1975. Сериализм, алеаторика, конкретная и электронная музыка. Булез, Штокхаузен, Кейдж, Лигети, Шнитке. Композитор работает с самим понятием музыки — что считать звуком, что произведением, что исполнением. Параллельно — Шостакович, Бриттен, Барток сохраняют связь с традицией.",
    "cover_composer_id": "shostakovich"
  },
  {
    "key": "minimalism",
    "name_ru": "Минимализм",
    "year_start": 1960,
    "year_end": 2010,
    "summary_ru": "Эпоха ~1960–2010. Райх, Гласс, Райли, Адамс. Музыка возвращается к простой тональности, повторяющимся паттернам и постепенному изменению. Реакция на сложность сериализма. Влияние на саундтреки, эмбиент и электронику конца XX века.",
    "cover_composer_id": "glass"
  },
  {
    "key": "contemporary",
    "name_ru": "Современная классика",
    "year_start": 1990,
    "year_end": 2026,
    "summary_ru": "Музыка живущих и недавно живших композиторов. Пярт, Сильвестров, Каижелаускайте, Аданс, Кейтлин Аурелия Смит. Жанровые границы размыты — академическая музыка сосуществует с эмбиентом, неоклассикой для фортепиано и саундтреком. Сакральный минимализм Пярта особенно популярен у слушателей вне академической традиции.",
    "cover_composer_id": "part"
  }
]
